{
 "id": "shores-of-null/1672746396-107",
 "band": "shores-of-null",
 "title": "The First Son",
 "source": "itunes",
 "album": "The Loss of Beauty",
 "year": 2023,
 "itunes_year": 2023,
 "year_source": "metal-archives",
 "extractor_version": "0.3.0",
 "features": {
  "tempo_bpm": 112.34714673913044,
  "onset_rate": 3.2744084274838774,
  "tempo_var": 6.629644041380422,
  "low_onset_rate": 3.174171434805799,
  "lufs": -14.752708414769241,
  "rms_dbfs": -13.62023068555428,
  "crest": 13.619965553283691,
  "centroid": 904.39390835709,
  "flatness": 0.0003223721869289875,
  "sub100_share": 0.2756251394748688,
  "lowest_pitch": 72.674560546875,
  "harmonic_share": 0.9908491373062134,
  "clean_share": 1.0,
  "minor_share": 0.1462669541756796,
  "chord_rate": 0.7016589487465451,
  "repetitiveness": 0.5915881395339966,
  "vocal_share": 0.0006606923998333514,
  "vocal_voiced": 1.0,
  "song_length": 137.44
 }
}