{
 "id": "the-lonely/1778908000-105",
 "band": "the-lonely",
 "title": "No Hope Of Life (feat. Alone)",
 "source": "itunes",
 "album": "Beyond The Wounds",
 "year": 2024,
 "itunes_year": 2024,
 "year_source": "metal-archives",
 "extractor_version": "0.3.0",
 "features": {
  "tempo_bpm": 103.359375,
  "onset_rate": 2.699828582312234,
  "tempo_var": 5.076810934971866,
  "low_onset_rate": 5.09967621103422,
  "lufs": -11.29445498666987,
  "rms_dbfs": -10.43357177246326,
  "crest": 10.433572769165039,
  "centroid": 1929.7007126922213,
  "flatness": 0.008481616154313087,
  "sub100_share": 0.1263302117586136,
  "lowest_pitch": 99.591064453125,
  "harmonic_share": 0.8690983653068542,
  "clean_share": 0.2699149265274555,
  "minor_share": -0.14680745447807186,
  "chord_rate": 0.733286775442829,
  "repetitiveness": 0.6306251287460327,
  "vocal_share": 0.1703605055809021,
  "vocal_voiced": 0.5398305084745763,
  "song_length": 209.941
 }
}