{
 "id": "scar-symmetry/1456958159-105",
 "band": "scar-symmetry",
 "title": "Domination Agenda",
 "source": "itunes",
 "album": "The Unseen Empire",
 "year": 2011,
 "itunes_year": 2011,
 "year_source": "metal-archives",
 "extractor_version": "0.3.0",
 "features": {
  "tempo_bpm": 75.99954044117646,
  "onset_rate": 1.336493235707705,
  "tempo_var": 18.570190140080513,
  "low_onset_rate": 2.7398111332007953,
  "lufs": -7.595620161362337,
  "rms_dbfs": -7.380550226216228,
  "crest": 7.380550384521484,
  "centroid": 2532.330780317819,
  "flatness": 0.03953701630234718,
  "sub100_share": 0.28911665081977844,
  "lowest_pitch": 40.374755859375,
  "harmonic_share": 0.7290024757385254,
  "clean_share": 0.035686578743211794,
  "minor_share": -0.027583301751301526,
  "chord_rate": 1.7040288755273238,
  "repetitiveness": 0.9251065850257874,
  "vocal_share": 0.15152746438980103,
  "vocal_voiced": 0.873546511627907,
  "song_length": 240.243
 }
}