{
 "id": "satyricon/1560240008-104",
 "band": "satyricon",
 "title": "Min Hyllest Til Vinterland (Remastered 2021)",
 "source": "itunes",
 "album": "Dark Medieval Times (Remastered 2021)",
 "year": 1993,
 "itunes_year": 1994,
 "year_source": "metal-archives",
 "extractor_version": "0.3.0",
 "features": {
  "tempo_bpm": 129.19921875,
  "onset_rate": 2.066666666666667,
  "tempo_var": 6.4490591219091025,
  "low_onset_rate": 4.766666666666667,
  "lufs": -12.806274099049071,
  "rms_dbfs": -11.684724458017929,
  "crest": 11.684724807739258,
  "centroid": 751.2232658573939,
  "flatness": 0.0002528090262785554,
  "sub100_share": 0.04364364221692085,
  "lowest_pitch": 107.666015625,
  "harmonic_share": 0.9750452637672424,
  "clean_share": 0.9961300309597523,
  "minor_share": 0.008833641496870936,
  "chord_rate": 1.3666666666666667,
  "repetitiveness": 0.6746245622634888,
  "vocal_share": 0.00021294763428159058,
  "vocal_voiced": 0.85,
  "song_length": 269.4
 }
}