{
 "id": "boisson-divine/1875389904-104",
 "band": "boisson-divine",
 "title": "Lo xivau de hèr",
 "source": "itunes",
 "album": "Eretatge",
 "year": 2026,
 "itunes_year": 2026,
 "year_source": "metal-archives",
 "extractor_version": "0.3.0",
 "features": {
  "tempo_bpm": 161.4990234375,
  "onset_rate": 5.966486274035554,
  "tempo_var": 16.9750354759426,
  "low_onset_rate": 6.799794412867335,
  "lufs": -8.503441093598235,
  "rms_dbfs": -8.13696431076536,
  "crest": 8.136964797973633,
  "centroid": 2698.0309280422543,
  "flatness": 0.03934933617711067,
  "sub100_share": 0.33636292815208435,
  "lowest_pitch": 196.490478515625,
  "harmonic_share": 0.8103775382041931,
  "clean_share": 0.002320185614849188,
  "minor_share": 0.1037646616029324,
  "chord_rate": 1.3666253476841215,
  "repetitiveness": 0.7795616984367371,
  "vocal_share": 0.14476144313812256,
  "vocal_voiced": 0.8144578313253013,
  "song_length": 353.507
 }
}