{
 "id": "stream-of-passion/1045520619-106",
 "band": "stream-of-passion",
 "title": "Wherever You Are",
 "source": "itunes",
 "album": "Embrace the Storm",
 "year": 2005,
 "itunes_year": 2005,
 "year_source": "metal-archives",
 "extractor_version": "0.3.0",
 "features": {
  "tempo_bpm": 123.046875,
  "onset_rate": 2.7063988023081027,
  "tempo_var": 1.4756858272720423,
  "low_onset_rate": 4.243366023371963,
  "lufs": -12.332109812139153,
  "rms_dbfs": -11.426069128067107,
  "crest": 11.426069259643555,
  "centroid": 2255.478545329398,
  "flatness": 0.013951793313026428,
  "sub100_share": 0.3714296817779541,
  "lowest_pitch": 185.723876953125,
  "harmonic_share": 0.8725335597991943,
  "clean_share": 0.47633824670287045,
  "minor_share": -0.19067904986528883,
  "chord_rate": 1.4033178974930902,
  "repetitiveness": 0.6322424411773682,
  "vocal_share": 0.08298135548830032,
  "vocal_voiced": 0.9244558258642765,
  "song_length": 308.333
 }
}