{
 "id": "edguy/942905245-106",
 "band": "edguy",
 "title": "Vain Glory Opera",
 "source": "itunes",
 "album": "Vain Glory Opera",
 "year": 1998,
 "itunes_year": 1998,
 "year_source": "metal-archives",
 "extractor_version": "0.3.0",
 "features": {
  "tempo_bpm": 135.99917763157896,
  "onset_rate": 4.866578384065595,
  "tempo_var": 0.592463786144324,
  "low_onset_rate": 4.43325291151181,
  "lufs": -8.809066045621174,
  "rms_dbfs": -8.459817912998638,
  "crest": 8.459817886352539,
  "centroid": 2851.3386014277266,
  "flatness": 0.04712371528148651,
  "sub100_share": 0.28932827711105347,
  "lowest_pitch": 86.1328125,
  "harmonic_share": 0.7227067351341248,
  "clean_share": 0.009280742459396751,
  "minor_share": -0.14115516270898576,
  "chord_rate": 1.0999800457134565,
  "repetitiveness": 0.7316243052482605,
  "vocal_share": 0.21044224500656128,
  "vocal_voiced": 0.6741573033707865,
  "song_length": 370.187
 }
}