{
 "id": "striker/1072498049-106",
 "band": "striker",
 "title": "Escape from Shred City",
 "source": "itunes",
 "album": "Stand in the Fire",
 "year": 2016,
 "itunes_year": 2016,
 "year_source": "metal-archives",
 "extractor_version": "0.3.0",
 "features": {
  "tempo_bpm": 99.38401442307692,
  "onset_rate": 6.548816854967755,
  "tempo_var": 15.129139596454918,
  "low_onset_rate": 6.849527833001988,
  "lufs": -5.414572499976084,
  "rms_dbfs": -5.783313528951935,
  "crest": 5.783313751220703,
  "centroid": 2531.2087550721344,
  "flatness": 0.033296797424554825,
  "sub100_share": 0.2419486939907074,
  "lowest_pitch": 40.374755859375,
  "harmonic_share": 0.7800419330596924,
  "clean_share": 0.0,
  "minor_share": 0.1656493347111231,
  "chord_rate": 2.0047398535615577,
  "repetitiveness": 0.9084517359733582,
  "vocal_share": 4.478430128074251e-05,
  "vocal_voiced": 1.0,
  "song_length": 173.438
 }
}