{
 "id": "confess/1774731359-105",
 "band": "confess",
 "title": "Suicide Song (feat. George Kollias)",
 "source": "itunes",
 "album": "Destination Addiction (feat. George Kollias)",
 "year": 2025,
 "itunes_year": 2025,
 "year_source": "metal-archives",
 "extractor_version": "0.3.0",
 "features": {
  "tempo_bpm": 99.38401442307692,
  "onset_rate": 5.364160958826489,
  "tempo_var": 14.138521795295722,
  "low_onset_rate": 5.830609737854879,
  "lufs": -9.550802890465638,
  "rms_dbfs": -9.706791706422477,
  "crest": 9.706791877746582,
  "centroid": 2930.7764669581843,
  "flatness": 0.05007866024971008,
  "sub100_share": 0.18198901414871216,
  "lowest_pitch": 53.8330078125,
  "harmonic_share": 0.7143521904945374,
  "clean_share": 0.0007733952049497294,
  "minor_share": -0.08282683335618235,
  "chord_rate": 1.4659818769463697,
  "repetitiveness": 0.9230170845985413,
  "vocal_share": 0.08888468891382217,
  "vocal_voiced": 0.293598233995585,
  "song_length": 262.973
 }
}