{
 "id": "suicidal-tendencies/6771506316-107",
 "band": "suicidal-tendencies",
 "title": "I Feel Your Pain",
 "source": "itunes",
 "album": "Join The Army",
 "year": 1987,
 "itunes_year": 1987,
 "year_source": "metal-archives",
 "extractor_version": "0.3.0",
 "features": {
  "tempo_bpm": 151.99908088235293,
  "onset_rate": 2.3666523558436534,
  "tempo_var": 18.134738900731186,
  "low_onset_rate": 3.2333137819272446,
  "lufs": -14.578121468495958,
  "rms_dbfs": -14.354919003954201,
  "crest": 14.35491943359375,
  "centroid": 2286.695369900671,
  "flatness": 0.02525358274579048,
  "sub100_share": 0.13783110678195953,
  "lowest_pitch": 110.357666015625,
  "harmonic_share": 0.7000205516815186,
  "clean_share": 0.1136890951276102,
  "minor_share": 0.21005379556343684,
  "chord_rate": 1.466657797987616,
  "repetitiveness": 0.7700939774513245,
  "vocal_share": 0.007845556363463402,
  "vocal_voiced": 0.2765957446808511,
  "song_length": 207.827
 }
}