{
 "id": "sentenced/1045519155-106",
 "band": "sentenced",
 "title": "Crumbling Down (Give Up Hope)",
 "source": "itunes",
 "album": "Down",
 "year": 1996,
 "itunes_year": 1996,
 "year_source": "metal-archives",
 "extractor_version": "0.3.0",
 "features": {
  "tempo_bpm": 112.34714673913044,
  "onset_rate": 4.310190685157349,
  "tempo_var": 22.0850163136757,
  "low_onset_rate": 4.644313994084275,
  "lufs": -9.907877701594476,
  "rms_dbfs": -9.943196235093653,
  "crest": 9.943196296691895,
  "centroid": 2595.5444739303175,
  "flatness": 0.02803739160299301,
  "sub100_share": 0.36482107639312744,
  "lowest_pitch": 48.44970703125,
  "harmonic_share": 0.7821029424667358,
  "clean_share": 0.04422032583397983,
  "minor_share": 0.12619062946519233,
  "chord_rate": 1.603791882849246,
  "repetitiveness": 0.7768688201904297,
  "vocal_share": 0.05818122997879982,
  "vocal_voiced": 0.8669438669438669,
  "song_length": 326.04
 }
}