{
 "id": "the-kovenant/1460474505-107",
 "band": "the-kovenant",
 "title": "Planetary Black Elements",
 "source": "itunes",
 "album": "Nexus Polaris",
 "year": 1998,
 "itunes_year": 1998,
 "year_source": "metal-archives",
 "extractor_version": "0.3.0",
 "features": {
  "tempo_bpm": 117.45383522727273,
  "onset_rate": 3.5417070746254184,
  "tempo_var": 1.4154448284321306,
  "low_onset_rate": 3.7087687290888813,
  "lufs": -9.182002369395383,
  "rms_dbfs": -9.431507482115748,
  "crest": 9.431507110595703,
  "centroid": 2564.240587442438,
  "flatness": 0.04787720739841461,
  "sub100_share": 0.22010605037212372,
  "lowest_pitch": 26.91650390625,
  "harmonic_share": 0.6758638620376587,
  "clean_share": 0.003878975950349108,
  "minor_share": 0.17826836835368043,
  "chord_rate": 1.3030809048150125,
  "repetitiveness": 0.9080104231834412,
  "vocal_share": 0.1347002238035202,
  "vocal_voiced": 0.15472481827622014,
  "song_length": 348.467
 }
}