{
 "id": "deicide/214409247-105",
 "band": "deicide",
 "title": "Trick or Betrayed",
 "source": "itunes",
 "album": "Once Upon the Cross",
 "year": 1995,
 "itunes_year": 1995,
 "year_source": "metal-archives",
 "extractor_version": "0.3.0",
 "features": {
  "tempo_bpm": 103.359375,
  "onset_rate": 6.766666666666667,
  "tempo_var": 13.305623015719952,
  "low_onset_rate": 7.7,
  "lufs": -9.070908650865212,
  "rms_dbfs": -8.963235388995326,
  "crest": 8.963234901428223,
  "centroid": 2963.011935763316,
  "flatness": 0.05374304950237274,
  "sub100_share": 0.33474528789520264,
  "lowest_pitch": 75.3662109375,
  "harmonic_share": 0.7184845209121704,
  "clean_share": 0.0,
  "minor_share": -0.0018542143764269658,
  "chord_rate": 2.433333333333333,
  "repetitiveness": 0.9237024784088135,
  "vocal_share": 0.1655612736940384,
  "vocal_voiced": 0.01889763779527559,
  "song_length": 144.573
 }
}