{
 "id": "hooded-menace/364200708-105",
 "band": "hooded-menace",
 "title": "Rituals of Mortal Cremation",
 "source": "itunes",
 "album": "Never Cross the Dead",
 "year": 2010,
 "itunes_year": 2010,
 "year_source": "metal-archives",
 "extractor_version": "0.3.0",
 "features": {
  "tempo_bpm": 161.4990234375,
  "onset_rate": 3.107346773020414,
  "tempo_var": 10.528560969602383,
  "low_onset_rate": 5.4462099355088975,
  "lufs": -6.92831544153702,
  "rms_dbfs": -7.052847142576018,
  "crest": 7.052847862243652,
  "centroid": 2277.1007603758967,
  "flatness": 0.02232358790934086,
  "sub100_share": 0.16523471474647522,
  "lowest_pitch": 59.21630859375,
  "harmonic_share": 0.7963343262672424,
  "clean_share": 0.0,
  "minor_share": 0.12131649719522808,
  "chord_rate": 1.7040288755273238,
  "repetitiveness": 0.7117347121238708,
  "vocal_share": 0.16438619792461395,
  "vocal_voiced": 0.3832528180354267,
  "song_length": 379.842
 }
}