{
 "id": "king-diamond/336196905-107",
 "band": "king-diamond",
 "title": "One Down, Two to Go",
 "source": "itunes",
 "album": "Voodoo",
 "year": 1998,
 "itunes_year": 1998,
 "year_source": "metal-archives",
 "extractor_version": "0.3.0",
 "features": {
  "tempo_bpm": 89.10290948275862,
  "onset_rate": 3.9092427144450372,
  "tempo_var": 18.010356528940658,
  "low_onset_rate": 4.57748933229889,
  "lufs": -8.684189500989925,
  "rms_dbfs": -9.283265991232927,
  "crest": 9.283266067504883,
  "centroid": 2700.5223261212477,
  "flatness": 0.03543780371546745,
  "sub100_share": 0.2254396229982376,
  "lowest_pitch": 83.441162109375,
  "harmonic_share": 0.7895717024803162,
  "clean_share": 0.2009309542280838,
  "minor_share": 0.03321465733698281,
  "chord_rate": 1.236256243029627,
  "repetitiveness": 0.756851077079773,
  "vocal_share": 0.2284138798713684,
  "vocal_voiced": 0.663963963963964,
  "song_length": 225.515
 }
}