{
 "id": "at-the-gates/1189291223-103",
 "band": "at-the-gates",
 "title": "And the World Returned",
 "source": "itunes",
 "album": "Terminal Spirit Disease",
 "year": 1994,
 "itunes_year": 1994,
 "year_source": "metal-archives",
 "extractor_version": "0.3.0",
 "features": {
  "tempo_bpm": 112.34714673913044,
  "onset_rate": 4.0,
  "tempo_var": 1.252071267064388,
  "low_onset_rate": 7.466666666666667,
  "lufs": -18.114003780875496,
  "rms_dbfs": -17.30726984292772,
  "crest": 15.128393173217773,
  "centroid": 1950.2559052992024,
  "flatness": 0.010640870779752731,
  "sub100_share": 0.25710633397102356,
  "lowest_pitch": 131.890869140625,
  "harmonic_share": 0.9737876057624817,
  "clean_share": 0.41099071207430343,
  "minor_share": 0.2697366267925535,
  "chord_rate": 0.8,
  "repetitiveness": 0.5427477359771729,
  "vocal_share": 9.6691455837572e-06,
  "vocal_voiced": 0.0,
  "song_length": 185.987
 }
}